{
  "anomaly_ids": [
    "ANOMALY-DEV-005-001"
  ],
  "answer": "R900005业务招待费存在人均超标问题。单次活动总额3600元未超过5000元上限，但人均金额为3600元÷10人=360元，超过人均300元上限（06_business_entertainment.md第三条）。",
  "citations": [
    {
      "clause_no": "第二条",
      "doc_id": "06_business_entertainment.md"
    },
    {
      "clause_no": "第三条",
      "doc_id": "06_business_entertainment.md"
    }
  ],
  "record_ids": [
    "R900005"
  ]
}
