{
  "anomaly_ids": [
    "AN-RA-CASE-002-001",
    "AN-RA-CASE-002-002"
  ],
  "answer": "以R004209为线索核查发现，E0008（杨丹）在2025年2月26日至3月2日期间存在两项异常。第一，拆分报销：R004209、R004210、R004211三笔差旅住宿合计10,200元，在4天（≤7天）内分三次报销，规避AR-03（≥10,000元）的部门总经理审批（制度依据：01_expense_reimbursement_2025.md第十一条）。第二，审批不完整：三笔记录均为AR-02档位（3,000-10,000元），缺少必要的财务复核角色，且审批人均为报销人本人（制度依据：03_authorization_management.md附件二）。住宿标准未超标（D1/部门负责人级A类850元/晚，实际680元/晚）。",
  "citations": [
    {
      "clause_no": "第十一条",
      "doc_id": "01_expense_reimbursement_2025.md"
    },
    {
      "clause_no": "附件二",
      "doc_id": "03_authorization_management.md"
    }
  ],
  "record_ids": [
    "R004209",
    "R004210",
    "R004211"
  ]
}
