{
  "anomaly_ids": [],
  "answer": "无异常。R900012不构成超期报销。\n\n核查依据：\n1. R900012费用发生日期为2025-12-20，报销提交日期为2026-01-10，费用类型为other，金额900元，事由为「年末发生费用补充提交」。\n\n2. 第七条（60天规则）：费用发生后60天内提交报销申请。2025-12-20起算60天，截止日期为2026-02-18。实际提交日期2026-01-10（距费用发生仅21天），远在60天期限内，符合第七条规定。\n\n3. 第九条（会计年度末15天补充提交规则）：会计年度末（即2025-12-31）发生的费用，最迟可在财政年度结束后15天内（即2026-01-15前）补充提交。实际提交日期2026-01-10（距年末仅10天），在15天窗口内，符合第九条规定。\n\n4. 现行制度适用说明：第七条为通用时限规则，适用于所有费用；第九条为会计年度末费用的特殊补充规则，与第七条并行适用。R900012同时满足两条规则，不构成超期报销。2025修订版制度（XX证财规〔2025〕甲号）自2025-01-01施行，覆盖本笔费用的发生和报销期间，适用正确。",
  "citations": [
    {
      "clause_no": "第七条",
      "doc_id": "01_expense_reimbursement_2025.md"
    },
    {
      "clause_no": "第九条",
      "doc_id": "01_expense_reimbursement_2025.md"
    }
  ],
  "record_ids": [
    "R900012"
  ]
}
