{
  "anomaly_ids": [],
  "answer": "现行培训制度（《XX证券培训费管理办法》，发文字号：XX证人规〔2025〕戊号）规定：第三条 内部培训综合费用每日不超过800元；第四条 外部培训综合费用每日不超过1200元。无异常。",
  "citations": [
    {
      "clause_no": "第三条",
      "doc_id": "05_training_expense.md"
    },
    {
      "clause_no": "第四条",
      "doc_id": "05_training_expense.md"
    }
  ],
  "record_ids": []
}
