{
  "anomaly_ids": [
    "L3-008-CLAUSE-001",
    "L3-008-CLAUSE-002",
    "L3-008-CLAUSE-003"
  ],
  "answer": "一、适用制度对比\n(1) 差旅住宿：适用《XX证券差旅费管理办法》(XX证行规〔2025〕丁号, doc_id: 04_travel_expense.md)。该办法第三条、第四条规定差旅住宿标准按员工职级(员工级、经理级、部门负责人级、高管级)和城市档位(一类、二类、三类)两个维度确定,为一个4x3矩阵。第七条明确规定培训期间住宿不适用本办法住宿表,应按《XX证券培训费管理办法》执行。\n(2) 培训住宿：适用《XX证券培训费管理办法》(XX证人规〔2025〕戊号, doc_id: 05_training_expense.md)。该办法第五条规定培训期间住宿标准仅按城市档位一个维度确定(一类500元、二类420元、三类350元),不区分职级,为单一向量。第六条明确规定培训住宿标准仅适用于培训期间住宿,不得与差旅住宿标准混用。\n\n二、标准维度差异\n差旅住宿：职级x城市档位(双维度,12个标准值)。\n培训住宿：仅城市档位(单维度,3个标准值),全员统一,不按职级分档。\n\n三、培训住宿一、二、三类城市标准\n一类城市：500元/人/晚\n二类城市：420元/人/晚\n三类城市：350元/人/晚\n\n四、数值对照(以一类城市为例)\n同一类城市下:\n  差旅住宿(员工级)：450元/人/晚\n  培训住宿(不限职级)：500元/人/晚\n培训住宿比员工级差旅住宿高50元。\n  差旅住宿(经理级)：650元/人/晚\n  培训住宿(不限职级)：500元/人/晚\n经理级差旅住宿比培训住宿高150元。\n\n五、不能混用的原因\n1. 制度依据不同：差旅住宿依据《差旅费管理办法》第四条,培训住宿依据《培训费管理办法》第五条,分属不同制度文件且发文字号独立(丁号 vs 戊号)。\n2. 适用场景不同：差旅住宿适用于公务出差期间,培训住宿仅适用于培训期间。《差旅费管理办法》第七条已明确排除培训场景的适用。\n3. 标准维度不同：差旅按职级分档体现级别差异,培训不分职级体现均等原则。若混用,员工级差旅(450元)低于培训(500元),但经理级差旅(650元)高于培训(500元),无论用哪个标准套用在另一个场景都会导致多报或少报,违背制度设计本意。\n4. 明令禁止：《培训费管理办法》第六条直接规定不得与差旅住宿标准混用。\n\n审计结论：经核查,差旅住宿与培训住宿各有独立适用的管理办法、标准维度和数值,两制度均设有排他条款(差旅第七条、培训第六条),不存在交叉适用的合规空间。R002599(差旅住宿,合肥,员工级,294.48元未超标)和R001990(培训费,课程费3002.54元未超3500元上限)分别为两类费用下的合规报销记录,无违规。",
  "citations": [
    {
      "clause_no": "第三条",
      "doc_id": "04_travel_expense.md"
    },
    {
      "clause_no": "第四条",
      "doc_id": "04_travel_expense.md"
    },
    {
      "clause_no": "第七条",
      "doc_id": "04_travel_expense.md"
    },
    {
      "clause_no": "第五条",
      "doc_id": "05_training_expense.md"
    },
    {
      "clause_no": "第六条",
      "doc_id": "05_training_expense.md"
    }
  ],
  "record_ids": [
    "R002599",
    "R001990"
  ]
}
