{
  "anomaly_ids": [
    "L3-004-D001",
    "L3-004-D002",
    "L3-004-D003",
    "L3-004-D004",
    "L3-004-D005",
    "L3-004-D006"
  ],
  "answer": "## 计算方法\n1. 从6个全年超预算部门（累计已批准费用>年度预算）获取全部status=approved的报销记录。\n2. 按reimburse_date升序、record_id升序排列，逐笔累加amount字段。\n3. 定位首次使累计支出超过该部门年度预算的记录作为关键record_id。\n4. 检查该关键记录的special_approval字段是否为0（无专项审批）。\n\n## 部门超预算详情\n| 部门 | 年度预算 | 首次超预算记录 | reimburse_date | 金额 | 累计前 | 累计后 | special_approval |\n|------|---------|---------------|----------------|------|--------|--------|------------------|\n| D001 投资银行部 | 230,395.17 | R000079 | 2025-10-21 | 226.98 | 230,281.68 | 230,508.66 | 0 |\n| D002 固定收益部 | 107,785.42 | R002009 | 2025-09-28 | 746.04 | 107,412.40 | 108,158.44 | 0 |\n| D003 财富管理部 | 109,772.07 | R003968 | 2025-09-28 | 213.68 | 109,665.23 | 109,878.91 | 0 |\n| D004 研究所 | 264,890.39 | R000894 | 2025-09-30 | 126.41 | 264,827.18 | 264,953.59 | 0 |\n| D005 机构业务部 | 278,540.94 | R003479 | 2025-10-13 | 429.21 | 278,326.33 | 278,755.54 | 0 |\n| D006 运营管理部 | 340,961.75 | R000312 | 2025-10-06 | 256.90 | 340,833.30 | 341,090.20 | 0 |\n\n## 制度依据\n1. 《XX证券预算管理办法》（08_budget_management.md）第三条：部门费用累计使用达到年度预算额度的1.0倍后，原则上不得继续报销。\n2. 《XX证券预算管理办法》第四条：因监管要求、客户服务或经营连续性确需超预算支出的，应履行专项审批。\n3. 《XX证券费用报销管理办法(2025修订版)》（01_expense_reimbursement_2025.md）第十三条：部门年度预算不足时不得继续报销。预算使用达到预算额度的1.0倍后，确需发生的费用应履行专项审批。\n\n## 结论\n全部6个超预算部门的关键记录special_approval均为0，均未履行专项审批，构成超预算违规。每个部门形成1项发现，共6项发现。",
  "citations": [
    {
      "clause_no": "第三条",
      "doc_id": "08_budget_management.md"
    },
    {
      "clause_no": "第四条",
      "doc_id": "08_budget_management.md"
    },
    {
      "clause_no": "第十三条",
      "doc_id": "01_expense_reimbursement_2025.md"
    }
  ],
  "record_ids": [
    "R000079",
    "R002009",
    "R003968",
    "R000894",
    "R003479",
    "R000312"
  ]
}
