{
  "anomaly_ids": ["ANOM-RR-CASE-001-001"],
  "record_ids": ["R000465", "R000561", "R000888", "R001354"],
  "answer": "以R000465为线索,调查发现员工E0041邓柳(机构业务部,E1级/员工)在2025年12月18日至25日的连续7天内,以training_fee类型提交了4笔报销:R000465(12月18日,2157.72元,'机构业务部合规实务学习费用')、R000561(12月20日,2917.45元,'客户服务投行业务培训费')、R000888(12月23日,2606.07元,'机构业务部专业技能培训费')、R001354(12月25日,2083.49元,'客户服务项目管理培训费'),合计9764.73元。\n\n按现行2025版制度判断,构成异常:4笔报销单独金额均低于3000元,各自按AR-01档位仅经部门经理(E0005)审批;但合计9764.73元已达到《XX证券授权管理办法》附件二AR-02档位(大于等于3000元且小于10000元),按规定应经部门经理审批并经财务复核。依据《XX证券费用报销管理办法(2025修订版)》第十一条'同一员工、同一费用类型在7天内出现2笔及以上报销,且合计金额达到《授权管理办法》附件二较高审批线的,应重点核查拆分规避审批',该4笔报销构成通过拆分降低单笔金额以规避更高审批层级(财务复核)的疑似违规行为。\n\n关键计算:4笔金额2157.72+2917.45+2606.07+2083.49=9764.73元;各笔单独<3000元→AR-01;合计9764.73元∈[3000,10000)→AR-02,跨档触发拆分规避核查。7天窗口:首笔12-18至末笔12-25=7个自然日,4笔≥2笔,满足触发条件。各发票不同(FP202500000465/FP202500000561/FP202500000888/FP202500001354),排除重复报销。每笔培训费均未超过《XX证券培训费管理办法》第二条每人每期3500元上限,专项制度合规。\n\n历史制度(2022版)下会得出不同结论:2022版《XX证券费用报销管理办法》仅设单笔8000元(部门总经理审批)和30000元(分管副总审批)两档,无拆分规避条款。这4笔单笔均远低于8000元,按旧制度不会触发任何异常关注,属正常部门经理审批范围。2025版新增第七条(60天报销时限)、第十一条(拆分规避核查)和第十二条(制度标准1.0倍上限),制度收紧是产生差异的根本原因。\n\n制度依据:(1)《XX证券费用报销管理办法(2025修订版)》(XX证财规〔2025〕甲号)第十一条拆分规避条款;(2)《XX证券授权管理办法》(XX证综规〔2025〕丙号)附件二费用报销审批权限表AR-01/AR-02档位;(3)《XX证券培训费管理办法》(XX证人规〔2025〕戊号)第二条培训课程费标准。\n\n可执行控制建议:在费用报销系统中实施7天滑动窗口聚合检测,同一员工同一费用类型7天内多笔合计触发AR-02及以上档位时,系统自动升级至对应审批层级并强制财务复核;对培训费类高频报销类型,设置单人月累计上限预警。\n\n综上,该组记录按现行2025版制度构成拆分规避审批异常。",
  "citations": [
    {"doc_id": "01_expense_reimbursement_2025.md", "clause_no": "第十一条"},
    {"doc_id": "03_authorization_management.md", "clause_no": "附件二"},
    {"doc_id": "05_training_expense.md", "clause_no": "第二条"},
    {"doc_id": "02_expense_reimbursement_2022_deprecated.md", "clause_no": "第二条"}
  ]
}
