{
  "anomaly_ids": ["DEV-005-001"],
  "record_ids": ["R900005"],
  "answer": "R900005业务招待费超标。单次活动总额3600元，未超过5000元上限；但参与人数10人，人均360元，超过《XX证券业务招待费管理办法》第三条规定的300元上限，超标60元/人。",
  "citations": [
    {"doc_id": "06_business_entertainment.md", "clause_no": "第二条"},
    {"doc_id": "06_business_entertainment.md", "clause_no": "第三条"}
  ]
}
