{
  "anomaly_ids": [
    "ANOM-L3-003-001",
    "ANOM-L3-003-002",
    "ANOM-L3-003-003",
    "ANOM-L3-003-004",
    "ANOM-L3-003-005",
    "ANOM-L3-003-006"
  ],
  "answer": "2025全年单笔超标准专项扫描完成。共扫描办公用品(694条)、通讯费用(640条)、差旅住宿(883条)、业务招待(675条)、培训费(578条)、市内交通(770条)六种费用类型共4240条记录，发现6条单笔超标准异常: R004221办公用品650元>600元标准、R004222通讯费用330元>300元标准、R004223培训费3700元>3500元标准、R004224业务招待人均350元>300元标准、R004225差旅住宿900元/晚>850元/晚(部门负责人级一类城市)标准、R004226市内交通92元/天>80元/天(三类城市)标准。全部记录special_approval=0，无豁免适用。",
  "citations": [
    {
      "clause_no": "第二条",
      "doc_id": "07_office_communication.md"
    },
    {
      "clause_no": "第三条",
      "doc_id": "07_office_communication.md"
    },
    {
      "clause_no": "第二条",
      "doc_id": "05_training_expense.md"
    },
    {
      "clause_no": "第三条",
      "doc_id": "06_business_entertainment.md"
    },
    {
      "clause_no": "第四条",
      "doc_id": "04_travel_expense.md"
    },
    {
      "clause_no": "第六条",
      "doc_id": "04_travel_expense.md"
    }
  ],
  "record_ids": [
    "R004221",
    "R004222",
    "R004223",
    "R004224",
    "R004225",
    "R004226"
  ]
}
