{
  "anomaly_ids": [
    "ANOM-DEV007-001",
    "ANOM-DEV007-002",
    "ANOM-DEV007-003"
  ],
  "answer": "扫描开发库全部8条办公用品(office_supplies)和通讯费(communication)记录，按员工+自然月聚合后与XX证券办公与通讯费用管理办法(07_office_communication.md)月度标准比对。发现3项超标异常：(1)E9001开发员工甲2025年1月办公用品合计960元(R900001 480元+R900002 480元，共用发票FPDEV900001)，超出每人每月600元标准360元；(2)E9001开发员工甲2025年4月办公用品650元(R900007)，超出600元标准50元；(3)E9001开发员工甲2025年9月通讯费合计340元(R900014 180元+R900015 160元)，超出每人每月300元标准40元。其余E9001三月通讯费200元、五月办公用品590元，E9002五月办公用品590元均未超标。",
  "citations": [
    {
      "clause_no": "第二条",
      "doc_id": "07_office_communication.md"
    },
    {
      "clause_no": "第三条",
      "doc_id": "07_office_communication.md"
    },
    {
      "clause_no": "第四条",
      "doc_id": "07_office_communication.md"
    }
  ],
  "record_ids": [
    "R900001",
    "R900002",
    "R900007",
    "R900014",
    "R900015"
  ]
}
