{
  "anomaly_ids": [],
  "answer": "无异常。根据现行《XX证券培训费管理办法》（XX证人规〔2025〕戊号），内部培训综合费用每日不超过800元（第三条），外部培训综合费用每日不超过1200元（第四条）。",
  "citations": [
    {
      "clause_no": "第三条",
      "doc_id": "05_training_expense.md"
    },
    {
      "clause_no": "第四条",
      "doc_id": "05_training_expense.md"
    }
  ],
  "record_ids": []
}
