{
  "anomaly_ids": ["DEV-004-SPLIT-001"],
  "record_ids": ["R900003", "R900004"],
  "answer": "存在拆分报销。员工E9001将同一客户路演交通费合计10400元拆分为R900003（5200元，2025-02-03）和R900004（5200元，2025-02-06）两笔报销，单笔各适用AR-02审批档位，合并金额10400元达到AR-03档位，规避了部门总经理审批权限，违反《XX证券费用报销管理办法(2025修订版)》第十一条。",
  "citations": [
    {"doc_id": "01_expense_reimbursement_2025.md", "clause_no": "第十一条"},
    {"doc_id": "03_authorization_management.md", "clause_no": "附件二"}
  ]
}
