{
  "anomaly_ids": [],
  "answer": "无异常。R004236（费用发生日期2025-10-01）与R004237（费用发生日期2025-10-09）的费用发生日期间隔为8个日历日，超过《XX证券费用报销管理办法(2025修订版)》第十一条规定的'7天内'条件，不构成拆分报销。虽然两笔报销属于同一员工(E0010 闭想)、同一费用类型(travel_lodging)、合计金额(10,400元)达到附件二AR-03较高审批线(10,000元)，但'7天内'为拆分报销的必要条件，该条件不满足则第十一条不触发。",
  "citations": [
    {
      "clause_no": "第十一条",
      "doc_id": "01_expense_reimbursement_2025.md"
    },
    {
      "clause_no": "附件二",
      "doc_id": "03_authorization_management.md"
    }
  ],
  "record_ids": [
    "R004236",
    "R004237"
  ]
}
