{
  "anomaly_ids": [
    "L3-007-SPLIT-EVASION-001"
  ],
  "answer": "经两跳检索发现：XX证券费用报销管理办法(2025修订版)第五条未直接列示审批金额，统一按《XX证券授权管理办法》附件二执行。通过交叉引用附件二费用报销审批权限表，确认单笔费用审批档位如下：AR-01（≥0且<3000元，部门经理）、AR-02（≥3000且<10000元，部门经理并经财务复核）、AR-03（≥10000且<50000元，部门总经理）、AR-04（≥50000且<200000元，分管副总）、AR-05（≥200000元，总经理办公会）。审计发现员工E0007李丽娟（信息技术部部门经理）在同为travel_lodging类型下，于2025-01-10和2025-01-12（间隔2天）分别提交R004207和R004208两笔报销各5200元，单笔均落入AR-02档位，但合计10400元已达到AR-03档位（部门总经理审批），构成违反第十一条的拆分报销规避审批权限行为。此外AR-02档位要求部门经理+财务复核双重审批，但两笔报销实际仅由E0007本人以部门经理身份审批，缺少财务复核环节。",
  "citations": [
    {
      "clause_no": "第五条",
      "doc_id": "01_expense_reimbursement_2025.md"
    },
    {
      "clause_no": "第十一条",
      "doc_id": "01_expense_reimbursement_2025.md"
    },
    {
      "clause_no": "附件二",
      "doc_id": "03_authorization_management.md"
    }
  ],
  "record_ids": [
    "R004207",
    "R004208"
  ]
}
