{
  "anomaly_ids": [],
  "record_ids": ["R900008", "R900009"],
  "answer": "经核查，R900008与R900009虽为同日（2025-05-05）、同额（590.00元）、同费用类型（office_supplies），但使用不同发票（FPDEV900008 vs FPDEV900009），由不同员工提交（E9001开发员工甲 vs E9002开发经理乙），分属不同供应商（开发供应商08 vs 开发供应商09），报销事项不同（五月办公用品甲 vs 五月办公用品乙）。依据《XX证券费用报销管理办法(2025修订版)》第十条（同一发票重复报销）要求同一发票，第十一条（拆分规避审批）要求同一员工，两笔报销均不满足任一规则的适用条件，属于独立合规报销，无异常。",
  "citations": [
    {"doc_id": "01_expense_reimbursement_2025.md", "clause_no": "第十条"},
    {"doc_id": "01_expense_reimbursement_2025.md", "clause_no": "第十一条"}
  ]
}
