{
  "anomaly_ids": [
    "L2-003-DUP-001"
  ],
  "answer": "以R000020为线索核查发现重复报销异常1项。发票FP202500000020（XX供应商2706，金额669.50元，开票日期2025-01-05）被员工E0028杜丹（财务管理部D009）在两条已批准的差旅住宿费报销记录中重复使用：R000020（费用日期2025-01-05，报销日期2025-02-28）与R004203（费用日期2025-04-10，报销日期2025-04-18）。两条记录金额均为669.50元，报销事由均为'财务管理部跨部门协同赴杭州住宿费'，且均无特殊审批。依据《XX证券费用报销管理办法(2025修订版)》（01_expense_reimbursement_2025.md）第十条'同一发票最多报销1次。发现同一发票在不同报销单中重复出现的，应认定为重复报销风险'，上述两条记录构成重复报销违规，涉及重复报销金额669.50元。",
  "citations": [
    {
      "clause_no": "第十条",
      "doc_id": "01_expense_reimbursement_2025.md"
    }
  ],
  "record_ids": [
    "R000020",
    "R004203"
  ]
}
