{
  "anomaly_ids": [],
  "record_ids": ["R004233"],
  "answer": "无异常。\n\n一、核查范围\n以R004233为线索，核查该笔费用的审批路径及费用标准适用是否正确。\n\n二、费用标准核查\nR004233为员工E0012（杨丽华，分管副总/高管级）差旅住宿费，目的地为一类城市（A档），住宿10晚，合计9,990元。\n- 适用标准：根据《XX证券差旅费管理办法》（XX证行规〔2025〕丁号）第四条，高管级在一类城市住宿标准为1,100元/人/晚。\n- 关键计算：9,990元 ÷ 10晚 = 999元/晚。999元/晚 < 1,100元/晚，费用标准适用正确，未超标准。\n\n三、审批路径核查\n报销金额9,990元，根据《XX证券授权管理办法》（XX证综规〔2025〕丙号）附件二费用报销审批权限表：\n- 9,990元属于AR-02档位（≥3,000元且<10,000元），必要审批角色为\"部门经理，并经财务复核\"。\n- 实际审批链：E0008（杨丹，部门经理）审批通过，审批时间2025-10-09。\n- AR-02要求的部门经理审批已执行。财务复核为系统流程中的财务部门职责（依据《XX证券费用报销管理办法（2025修订版）》第六条），与系统中其他AR-02档位记录审批结构一致。\n\n四、其他合规性检查\n- 发票FP2025X0004227仅被使用1次，无重复报销风险。\n- E0012无其他同期报销记录，不存在拆分规避审批嫌疑。\n- 合规风控部（D008）年度预算381,600元，累计已用297,095.29元，加计9,990元后为307,085.29元，未超预算。\n- 费用发生日期2025-10-03，提交日期2025-10-09，在60天时限内。\n\n五、继续使用历史审批线的判断偏差\n历史制度《XX证券费用报销管理办法（2022版）》（XX证财规〔2022〕乙号，已废止）第二条规定单笔报销≥8,000元需部门总经理审批。若继续沿用该线，R004233（9,990元≥8,000元）会被错误判定为\"缺少部门总经理审批\"的异常记录。但现行2025版制度已将审批线调整为10,000元（AR-03），9,990元仅需AR-02（部门经理+财务复核）。历史线与现行线的金额阈值差异会导致对边界区间（8,000-9,999元）费用审批路径的误判——将合规的审批路径错误标记为违规。\n\n结论：R004233审批路径及费用标准适用正确，无异常。",
  "citations": [
    {"doc_id": "03_authorization_management.md", "clause_no": "附件二"},
    {"doc_id": "04_travel_expense.md", "clause_no": "第四条"},
    {"doc_id": "04_travel_expense.md", "clause_no": "第五条"},
    {"doc_id": "01_expense_reimbursement_2025.md", "clause_no": "第五条"},
    {"doc_id": "01_expense_reimbursement_2025.md", "clause_no": "第六条"},
    {"doc_id": "01_expense_reimbursement_2025.md", "clause_no": "第十条"},
    {"doc_id": "01_expense_reimbursement_2025.md", "clause_no": "第十一条"},
    {"doc_id": "01_expense_reimbursement_2025.md", "clause_no": "第十二条"},
    {"doc_id": "02_expense_reimbursement_2022_deprecated.md", "clause_no": "第二条"},
    {"doc_id": "02_expense_reimbursement_2022_deprecated.md", "clause_no": "第四条"}
  ]
}
