{
  "anomaly_ids": [
    "DUP-FP202500000002",
    "DUP-FP202500000005",
    "DUP-FP202500000020",
    "DUP-FP202500000028",
    "DUP-FP202500000037",
    "DUP-FP202500000055"
  ],
  "answer": "全量扫描方法：调用 find_reused_invoices(min_usage_count=2) 对全年数据进行全量重复发票扫描，共发现6张发票各被报销2次。逐组调用 get_expense_detail 核实每对记录：确认同一发票号（FP2025开头）、同一发票ID（INV开头）、同一金额、同一供应商、同一员工、同一事由，均构成重复报销。制度依据：《XX证券费用报销管理办法(2025修订版)》（XX证财规〔2025〕甲号）第十条：「同一发票最多报销1次。发现同一发票在不同报销单中重复出现的,应认定为重复报销风险。」发现ID以 DUP-{发票号} 格式生成，确保稳定且与发票一一对应。共6组重复报销异常，涉及12条记录。",
  "citations": [
    {
      "clause_no": "第十条",
      "doc_id": "01_expense_reimbursement_2025.md"
    }
  ],
  "record_ids": [
    "R000002",
    "R004201",
    "R000005",
    "R004202",
    "R000020",
    "R004203",
    "R000028",
    "R004204",
    "R000037",
    "R004205",
    "R000055",
    "R004206"
  ]
}
