{
  "anomaly_ids": [
    "L2-003-001"
  ],
  "answer": "发票FP202500000020在两笔报销记录中重复使用: R000020(BX2025000020, 2025-01-05, E0028杜丹, 669.50元)与R004203(BX2025X004203, 2025-04-10, E0028杜丹, 669.50元), 违反2025修订版费用报销管理办法第十条同一发票最多报销1次的规定, 构成重复报销异常。",
  "citations": [
    {
      "clause_no": "第十条",
      "doc_id": "01_expense_reimbursement_2025.md"
    }
  ],
  "record_ids": [
    "R000020",
    "R004203"
  ]
}
