{
  "anomaly_ids": ["ANOM-001"],
  "record_ids": ["R900006"],
  "answer": "扫描开发库全部21条已审批报销记录，依据《XX证券费用报销管理办法(2025修订版)》第七条（费用发生后60天内提交报销）和第九条（会计年度末费用在财政年度结束后15天内补充提交），识别超期报销异常。发现1条超期记录：R900006（开发员工甲，通讯费，费用日期2025-03-01，报销日期2025-05-05，延迟65天，超出60天期限）。年末补充提交核对：2条12月费用记录（R900012：2025-12-20→2026-01-10，R900021：2025-12-02→2025-12-08）均在财政年度结束后15天内（2026-01-15前）提交，符合第九条豁免规定，无第九条违规。其余18条记录均在60天内提交，合规。",
  "citations": [
    {"doc_id": "01_expense_reimbursement_2025.md", "clause_no": "第七条"},
    {"doc_id": "01_expense_reimbursement_2025.md", "clause_no": "第九条"}
  ]
}
