{
  "anomaly_ids": [],
  "answer": "费用报销审批线应采用《XX证券费用报销管理办法(2025修订版)》(XX证财规〔2025〕甲号)，该办法自2025年1月1日起施行，原《XX证券费用报销管理办法(2022版)》(XX证财规〔2022〕乙号)同时废止。2022版为已废止的存档制度，其审批金额已被后续制度替代，不得作为现行审批依据。部门总经理审批线：单笔报销金额大于等于10,000元且小于50,000元，须经部门总经理审批。该金额标准出自《XX证券授权管理办法》(XX证综规〔2025〕丙号)第二条及附件二「费用报销审批权限表」AR-03档位。效力状态：2025修订版为现行有效制度，2022版已废止失效。",
  "citations": [
    {
      "clause_no": "第五条",
      "doc_id": "01_expense_reimbursement_2025.md"
    },
    {
      "clause_no": "第十四条",
      "doc_id": "01_expense_reimbursement_2025.md"
    },
    {
      "clause_no": "第一条",
      "doc_id": "02_expense_reimbursement_2022_deprecated.md"
    },
    {
      "clause_no": "第四条",
      "doc_id": "02_expense_reimbursement_2022_deprecated.md"
    },
    {
      "clause_no": "第二条",
      "doc_id": "03_authorization_management.md"
    }
  ],
  "record_ids": []
}
